Title,topic
Бишкекте бир жумада 19 мас айдоочу кармалды,ukuktartibi
Бишкекте кармалган УКТ мүчөлөрү Азербайжанга өткөрүлүп берилди,ukuktartibi
Бишкекте автоээнбаштык жасаган айдоочуга айып салынды,ukuktartibi
Ысык-Көлдө аялдын өлтүрүлүшү. Жаңы жагдайлар белгилүү болду,ukuktartibi
УКМК Нарын мамлекеттик университетинин бир катар жетекчилерин кармады,ukuktartibi
Бишкекте келин мурдагы күйөөсүнүн колунан ажал тапты,ukuktartibi
УКМК: Кочкор-Атада шаардын жолдору жеке менчикке мыйзамсыз сатылып кеткен,ukuktartibi
Сөөгүн ашканада 9 күн кармаган. Ысык-Көлдө чогуу жашаган аялды өлтүрүүгө шектүү жаран кармалды,ukuktartibi
Директорлордон акча талап кылган. УКМК Эсептөө палатасынын дагы бир инспекторун кармады,ukuktartibi
Опузалап пара талап кылууга шектелип Бишкек шаардык милициясынын кызматкерлери кармалды,ukuktartibi
"УКМК Ала-Бука районунда ""безпредельщик"" атыккан жаранды кармады",ukuktartibi
"Башкы прокуратура ""Бишкекбашкыархитектуранын"" кызматкерлерине иш козгоду",ukuktartibi
Бишкекте өз билемдик менен асфальтты бузган жаранга айып салынды,ukuktartibi
Бишкекте мыйзамсыз курулуштарга жол берген мэриянын кызматкери кармалды,ukuktartibi
Баткенде муниципалдык ишкананын директору кызмат абалынан пайдаланууга шектелип кармалды,ukuktartibi
Салык кызматы: Мыйзамсыз жүгүртүүдөн 20 миңден ашык куту тамеки тартып алынды,ukuktartibi
Бишкекте таштанды өрттөгөн жактарга айып салынды,ukuktartibi
УКМК “Таранчы” каймана аттуу УКТ мүчөсүн кармады,ukuktartibi
Ананьев айыл аймагынын айылдык кеңешинин төрагасы кармалды (видео),ukuktartibi
Токтогулда “Хизб ут-Тахрир” уюмунун материалдарын таркатып жүргөн жаран кармалды,ukuktartibi
УКМК: Эсептөө палатасынын мамлекеттик инспектору кармалды,ukuktartibi
Ат-Башы айыл өкмөтүнүн жооптуу катчысы пара берүү учурунда кармалды,ukuktartibi
Бишкекте жаңы салынган аялдаманын айнегин талкалап кетишти,ukuktartibi
Кочкор-Атада шектүүнү кармоо учурунда анын уулу спецназга кол салган. Окуянын чоо-жайы,ukuktartibi
"УКМК: Караколдогу ""Бугу"" жана ""Макиш"" базарларынын ээси кармалып, мүлкү мэрияга өттү",ukuktartibi
Өлкөгө телефон аксессуарларын жана компьютер тетиктерин мыйзамсыз алып кирүү аракети көрүлгөн,ukuktartibi
"УКМК ""Мадина"" базарынын негиздөөчүсүнүн уулун кармады",ukuktartibi
"УКМК Мамкурулуштун башкармалык башчысын кармап, 1,5 млн долларды кайтарды",ukuktartibi
Бишкекте унаа уурдоого шектелген жаран кармалды,ukuktartibi
УКМК: Райымбек Матраимов жана анын бир туугандары кармалды,ukuktartibi
Нарында УКМК кызматкерине пара берүүгө аракет кылган айыл аймак башчысы кармалды,ukuktartibi
УКМК ишкер Азим Ройдун жубайына издөө жарыялады,ukuktartibi
"Жалал-Абадда  автоээнбаштык жасаган  айдоочуга 20,5 миң сом айып салынды",ukuktartibi
Бишкекте автоээнбаштык жасаган айдоочуга 15 миң сом айып салынды,ukuktartibi
"Ошто ""Бойко"" каймана аттуу кылмыштуу топтун активдүү мүчөсү кармады",ukuktartibi
Кыргызстанда бир жумада 23 миңден ашуун жол эрежесин бузуу фактысы катталды,ukuktartibi
"Бир күндө 15 мас айдоочу кармалды. Ысык-Көлдө ""Рулда"" аталышындагы рейд өттү",ukuktartibi
УКМК: Матраимов Бакуда экендиги аныкталды. Анын Бишкекте кармалган УКТ мүчөлөрү менен байланышы бар,ukuktartibi
УКМК КР жетекчилигине кол салууну уюштурууга аракеттенген трансулуттук УКТ мүчөлөрүн кармады,ukuktartibi
УКМК: 20 миң доллар өлчөмүндө пара талап кылган салыкчы кармалды,ukuktartibi
УКМК: Пара талап кылууга шектелип Бишкектин Свердлов райондук сотунун судьясы кармалды,ukuktartibi
Нарында кызмат абалынан кыянаттык менен пайдаланууга шектелип участкалык инспектор кармалды,ukuktartibi
Ысык-Атада мечит катары пайдаланылып келген мурдагы мектептин имараты мамлекетке кайтарылды,ukuktartibi
Сузакта кыргыз-өзбек чек арасы аркылуу аткезчилик жүк ташуучу жер астындагы тоннель табылды,ukuktartibi
"Чүй районунун бюджетинен 17,2 млн  сом каржылык бузуулар аныкталды",ukuktartibi
ИИМ: Москвада мекендештерин карактаган кыргызстандыктар кармалды,ukuktartibi
Бишкекте “Нур Имарат Курулуш” компаниясына 53 миң сом айып салынды,ukuktartibi
Сузакта адам өлтүрүүгө аракет кылган жаран чек арадан кармалды,ukuktartibi
Кочкор районунун акиминин орун басары УКМК кызматкерине пара берүүгө аракет кылган,ukuktartibi
Эсептөө палатасы Талас шаарынын бюджетинен 292 млн сом каржылык бузууларды аныктады,ukuktartibi
Бишкекте жергиликтүү тургунду опузалаган УКТ мүчөсү кармалды,ukuktartibi
Бишкекте телефон алдамчылык менен алектенген дагы 3 жигит кармалды,ukuktartibi
Чүйдө милиция мамлекеттер аралык издөөдө жүргөн өзбекстандык жаранды кармады,ukuktartibi
Ала-Букада кен казган ишканадагы уурулук фактысынын бети ачылды,ukuktartibi
Баткенде баңгизат даярдоо жана сатуу менен алектенген кылмыштуу топ кармалды,ukuktartibi
"Ала-Букада документти жасалмалоо жолу менен балдарды мыйзамсыз асырап, өлкөдөн чыгарып кетишкен",ukuktartibi
Панфилов районунда диний-экстремисттик уюмдун мүчөсү кармалды,ukuktartibi
Жалал-Абадда бажы мыйзамын бузуу фактысы аныкталды,ukuktartibi
Эсептөө палатасы Сокулук районунун жергиликтүү бюджетинде каржы бузууларды аныктады,ukuktartibi
Токтогулда милиция мал уурулукка шектелген жаранды кармады,ukuktartibi
Баткенде диний-экстремисттик материалдарды таратууга шектелген жаран кармалды,ukuktartibi
Бишкекте эл аралык издөөдө жүргөн жаран кармалды,ukuktartibi
Ошто Өзбекстандын аймагында издөөдө жүргөн жаран кармалды,ukuktartibi
УКМК мурдагы айыл чарба министри Эркинбек Чодуевди кармады. Окуянын чоо-жайы,ukuktartibi
Нарындагы Ала-Буга айыл аймагынын жоон топ кызмат адамдары кармалды (видео),ukuktartibi
Жалал-Абадда диний экстремисттик материалдарды таратууга шектелген жаран кармалды,ukuktartibi
Жер ресурстары кызматынын Жалал-Абаддагы филиалынын директору кармалды,ukuktartibi
"УКМК: ""Тон Манжылы Сервис"" ЖЧКсынын подрядчы фирмасынын башкы директору кармалды",ukuktartibi
Жети-Өгүз районунун Тамга айыл өкмөтүнүн адиси пара менен кармалды,ukuktartibi
Бишкекте абакка телефон алып кирүүгө аракет кылган жаран кармалды,ukuktartibi
"Оштогу абактан качып, издөөдө жүргөн жаран Бишкектен кармалды",ukuktartibi
УКМК Көлбаевдин кылмыштуу тобун каржылаган орусиялык ишкерге издөө жарыялады,ukuktartibi
Жалал-Абадда бала бакчанын жери мыйзамсыз менчиктештирилген. Кылмыш иши козголду,ukuktartibi
Бишкекте эки үлпөт той кортежине 30 миң сом айып салынды,ukuktartibi
Ошто опузалап акча талап кылуу менен алектенген адамдардын тобу кармалды,ukuktartibi
Кыргызстанда бир жумада 339 мас айдоочу кармалды,ukuktartibi
Таласта баңгизат сатуу менен алектенген жаран кармалды,ukuktartibi
"Таш-Көмүрдөгү ""Кристалл"" ишканасы мамлекеттин менчигине кайтарылды",ukuktartibi
Зыян бир млн сомдон ашат. Бишкекте спорт мектебинин директору кармалды,ukuktartibi
Бишкекте мыйзамсыз курулушка уруксат берген кызмат адамдарына кылмыш иши козголду,ukuktartibi
Ошто мамлекеттер аралык издөөдө жүргөн жаран кармалды,ukuktartibi
100 миң сом талап кылышкан. Ошто коркутуп опузалоо менен алектенген топ кармалды,ukuktartibi
Жалал-Абадда үлпөт той учурунда унаада баратып ок чыгарган жаран кармалды,ukuktartibi
Ошто баңгизат сатуу менен алектенген кылмыштуу топтун мүчөсү кармалды,ukuktartibi
Бишкекте CHARGE FAST пирамидасынын негизги уюштуруучусу кармалды,ukuktartibi
ИИМ: Ош шаарында опузалап акча талап кылууга шектелген жаран кармалды,ukuktartibi
УКМК: Талас райондук суу чарба башкармалыгынын мурдагы жетекчилери кармалды,ukuktartibi
Милиция жетиөгүздүк жарандын үйүнөн алты килограммдан ашуун баңгизат тапты,ukuktartibi
"Коррупция фактысы боюнча Чүйдүн Москва районундагы ""жер мафиясынын"" мүчөлөрү кармалды (видео)",ukuktartibi
УКМК: Нарында тергөөчү жана прокуратура кызматкери пара менен кармалды,ukuktartibi
УКМК: Москва райондук сотунун судьясы кармалды,ukuktartibi
Саркынды сууларды чыгарууну өнүктүрүү департаментинин башчысы кармалды — УКМК,ukuktartibi
Нарында Көлбаевдин кылмыштуу тобунун мүчөсүнө профилактикалык иш-чара өткөрүлдү,ukuktartibi
Бишкекте Telegram аркылуу синтетикалык баңгизат сатууга көмөктөшкөндөр кармалды,ukuktartibi
УКМК: Көлбаевдин кылмыштуу тобунун активдүү мүчөсү катары аныкталган Рысалиев кармалды,ukuktartibi
Бишкекте ири өлчөмдөгү алдамчылыкка катыштыгы бар курьер кармалды,ukuktartibi
"""100 миң сом таап бересиң"". Жалал-Абадда акча опузалагандар кармалды (видео)",ukuktartibi
Бишкекте CHARGE Fast пирамидасын негиздөөчүлөрдүн бири кармалды,ukuktartibi
Ошто 12 жылдан бери эл аралык издөөдө жүргөн жаран кармалды,ukuktartibi
Кыргызстанда бир жумада 21 миңден ашуун жол эрежесин бузуу фактысы катталды,ukuktartibi
Караколдо алдамчылыкка шектелип Charge fast компаниясынын өкүлдөрү кармалды,ukuktartibi
Кемин райондук архитектура жана шаар куруу башкармалыгынын башчысы кармалды,ukuktartibi
Бишкекте каржы пирамидасын уюштурууга шектүү кыздар кармалды,ukuktartibi
Бишкекте жабырлануучуну $50 миң алдап кетүүгө шектелген жаран кармалды,ukuktartibi
Ош шаарында мыйзамсыз кумар оюндарын уюштургандар кармалды,ukuktartibi
Талас облустук лицейинин жооптуу кызматкерлерине кылмыш иши козголду,ukuktartibi
"Бишкекте уурулукка шектелип, мурда бир нече жолу соттолгон жаран кармалды",ukuktartibi
"""Манас"" бажысы товардын баасын дээрлик 109 миң долларга төмөндөтүү фактысын аныктады",ukuktartibi
Токтогулда кылмыш изи сууй электе адам өлтүрүү фактысынын бети ачылды,ukuktartibi
"УКМК Ысык-Көлдө ""жер мафиясынын"" ишмердүүлүгүнө бөгөт койду",ukuktartibi
Бишкек жана Чүй облусунун аймагында баңгизат сатып жүргөн жаран кармалды,ukuktartibi
Таласта уюшкан кылмыштуу топтун мүчөсү бангизат менен кармалды,ukuktartibi
Бишкекте телефон аркылуу алдамчылык кылган жаранды кармалды,ukuktartibi
Бажы кызматы  жеңил унааларды мыйзамсыз ташып кирүүнүн жөнгө салынган схемасын аныктады,ukuktartibi
Эмгек министринин мурдагы орун басары Улан Чаначев 29-мартка чейин камакта калтырылды,ukuktartibi
ЖК мурдагы депутаты Камчыбек Жолдошбаев 19-апрелге чейин камакта калтырылды,ukuktartibi
УКМК: Кыймылсыз мүлктү мыйзамсыз ээлеп алган уюшкан кылмыштуу топ аныкталды,ukuktartibi
УКМК: Жарандардан системалуу түрдө акча алып турган Калкты каттоо департаментинин кызматкерлери кармалды,ukuktartibi
Ысык-Көл өнүктүрүү фондун директорунун орун басары жана бөлүм башчысы кармалды,ukuktartibi
Жаза аткаруу мекемелериндеги уюшкан кылмыштуу топторду каржылоо каналына бөгөт коюлду,ukuktartibi
Массалык баш аламандыкка чакырган кыргызстандык Москвада кармалды – ИИМ,ukuktartibi
УКМК Жогорку Кеңештин мурдагы депутаты Камчыбек Жолдошбаевди кармады,ukuktartibi
"Бишкекте бирөөнүн паспортун колдонуп, унааларды мыйзамсыз каттаган бажычы кармалды",ukuktartibi
Ошто жер тилкесин мыйзамсыз менчиктештирген кызмат адамдарына кылмыш иши козголду,ukuktartibi
Жалал-Абадда УКТ мүчөлөрүнө көмөктөшкөн мурдагы милиция кызматкери кармалды,ukuktartibi
Эмгек министринин орун басары Улан Чаначев кармалды,ukuktartibi
УКМК: Улуттук госпиталдын кош бойлуу медайымын сабоого шектелген жаран кармалды,ukuktartibi
Ала-Бука районунун башкы архитектору жер тилкелерин туугандарына мыйзамсыз каттаган,ukuktartibi
УКМК: ЖКККББнын кызмат адамдары жана автомектептин директору кармалды,ukuktartibi
"Ошто милиция кызматкерин опузалап, 150 миң сом талап кылган жаран кармалды",ukuktartibi
Бишкекте жогорку окуу жайдын имаратына уурулукка кирген жаран кармалды,ukuktartibi
УКМК: Баткенде эл аралык наркоканал уюштурган милиция кызматкери кармалды,ukuktartibi
Ысык-Көл жана Нарында бир катар кылмыштарга шектүү УКТ мүчөлөрү кармалды,ukuktartibi
Бишкекте уруксат берүүчү документтери жок күйүүчү май сактаган кампа аныкталды,ukuktartibi
Кара-Сууда чет элдик жарандан $58 миң опузалап талап кылган жаран кармалды,ukuktartibi
Баткенде үйүнө баңгизат сактаган жаран кармалды,ukuktartibi
Аскер кызматкеринин мыйзам бузуулар тууралуу билдирүүсү тастыкталды: аскер бөлүгүнүн командирлери кармалды,ukuktartibi
Айыл чарба министрлигинде дээрлик жарым млрд сомдук финансылык бузуулар аныкталды,ukuktartibi
"УКМК: УКТнын активдүү мүчөсүн ""положенец"" статусуна дайындоо аракети токтотулду",ukuktartibi
Ошто Калкты каттоо департаментинде системалуу түрдө мыйзамсыз акча жыйноо фактысы аныкталды,ukuktartibi
"Ысык-Ата районунун ""Кадастр"" мамлекеттик мекемесинин директору кармалды",ukuktartibi
ИИМ: Пара талап кылууга шектелип сот аткаруучу кармалды,ukuktartibi
"УКМК Сокулуктагы ""Новопавловка коммуналдык ишканасынын"" мурдагы жетекчисин кармады",ukuktartibi
Бишкекте жарандарды мыйзамсыз  жоопкерчиликке тарткан милиционерлерге 77 кылмыш иши козголду,ukuktartibi
Бишкекте өзгөчө ири өлчөмдөгү алдамчылыкка шектүү жаран кармалды,ukuktartibi
Кызыл-Кыя милициясы тарабынан 2015-жылдан бери издөөдө жүргөн жаран Польшада кармалды,ukuktartibi
Жалал-Абадда сот адилеттигине жатпаган чечим чыгарган судьяга кылмыш иши козголду,ukuktartibi
"Бишкек Тез жардам борборунун жетекчилиги мыйзамсыз 18,4 млн сомду өздөштүрүп алган",ukuktartibi
УКМК Кыргызстан жана Казакстанда жасалма долларларды сатып жүргөн кылмыштуу топту кармады (видео),ukuktartibi
МСКнын Панфилов району боюнча текшерүү жана жазалоо бөлүмүнүн мурдагы башчысы кармалды,ukuktartibi
Бишкекте аялдамадан сыналгы уурдалды,ukuktartibi
УКМК: Ош ОИИБсинин бөлүмү башчысы пара талап кылууга шектелип кармалды,ukuktartibi
Бишкекте милициянын сержанты ири өлчөмдөгү баңгизаты менен кармалды,ukuktartibi
"Бишкекте 29 жаштагы жаран 1,1 кг баңгизат менен кармалды",ukuktartibi
«Манас» бажысы жалган декларациялоо фактысын аныктады,ukuktartibi
Лейлекте коңшу өлкөдөн 94 баш кой айдап келе жаткан жаран кармалды,ukuktartibi
УКМК: Элиталык эскорт жана интимдик кызматтын уюштуруучусу кармалды,ukuktartibi
УКМК: Чолпон-Атанын улгайган тургундарынан $6 миң опузалаган эки жаран кармалды,ukuktartibi
Бишкекте дем алыш күндөрү 93 мас айдоочу кармалды,ukuktartibi
УКМК: Бишкекте түңкү клубдарга баңгизаттарды жеткирип жүргөн жаран кармалды,ukuktartibi
УКМК: Караколдогу «Бугу» жана «Макиш» соода базарынын ээси кармалды,ukuktartibi
Бишкекте коомдук транспорттордо уурулук менен алектенген чөнтөкчү кармалды,ukuktartibi
Кыргызстанда акыркы жумада 422 мас айдоочу аныкталды,ukuktartibi
УКМК Чолпон-Атанын экс-мэринин кызмат абалынан кыянаттык менен пайдаланган фактыны аныктады,ukuktartibi
Мурда издөөдө жүргөн жаран Ысык-Көл облусунун аймагынан кармалды,ukuktartibi
Ошто соцтармакта террористтик уюмга таандык материалдарды тараткан жаран кармалды,ukuktartibi
Кара-Балтада адам өлтүрүүгө шектүү жаран кармалды,ukuktartibi
УКМК опузалап акча талап кылган блогерди кармады,ukuktartibi
"Чүйдө укук коргоо кызматкерин опузалап, 1 млн сом талап кылган жаран кармалды",ukuktartibi
ИИМ: Ош шаарында мугалим баңгизат сатууга шектелип кармалды,ukuktartibi
Салык кызматы күн карама майын мыйзамсыз ташып кирүүгө бөгөт койду,ukuktartibi
УКМК: Матраимовдун баасы 3 млрд сомдук кыймылсыз мүлкү мамлекеттин менчигине өткөрүлдү,ukuktartibi
Чүй облусунда 529 жолу жол эрежесин бузган айдоочу кармалды,ukuktartibi
Лейлекте жасалма билет сатып жүргөн жаран аныкталды,ukuktartibi
Бишкекте Интерпол тарабынан эл аралык издөө жарыяланган чет элдик жаран кармалды,ukuktartibi
Бишкектик кыз нарындык IT адисинин курмандыгы болду – милициянын маалыматы,ukuktartibi
УКМК: Экономика министрлигинин мурдагы кызматкерлери жана жеке компаниянын негиздөөчүсү кармалды,ukuktartibi
