Title,topic
Бишкекте автобуста контролерго кол салган жаранга айып салынды,ukuktartibi
УКМК: Кочкордо базардын ээси курал-жарактарды мыйзамсыз сактап жүргөн,ukuktartibi
"“Бишкек” эркин экономикалык аймагында 13,8 млн сомдук мамлекеттик мүлк мыйзамсыз сатылган",ukuktartibi
Бишкекте №226 автобуста контролерго кол салуу болгон,ukuktartibi
Чүйдө баңги кылмышына шектүү уюшкан кылмыштуу топтун мүчөсү кармалды,ukuktartibi
Кыргызстанда бир жумада 21 миңден ашуун жол эрежесин бузуу фактысы катталды,ukuktartibi
Таласта психикалык оорулууларга айдоочулук күбөлүк алууга мыйзамсыз медсправка берилген,ukuktartibi
"Түптө соцкамсыздоо башкармалыгынын эсепчиси 1,1 млн сом уурдоого шектелүүдө",ukuktartibi
"Ноокенде мыйзамсыз базар уюштуруп, соодагерлерден акча жыйнаган жаран кармалды",ukuktartibi
Кыргыз-тажик чек арасында аткезчилик жүктөр аныкталды – Чек ара кызматы,ukuktartibi
"Ысык-Көлдө ""Хизб ут-Тахрир"" уюмунун мүчөсүнүн үйүнөн басмакана табылды — УКМК",ukuktartibi
Кара-Сууда ири суммадагы алдамчылыкка шектүү катары УКТ мүчөсү кармалды,ukuktartibi
"УКМК: Коррупциялык схема уюштурган ""Унаа"" мекемесинин адистери кармалды",ukuktartibi
"УКМК Баткенде ""Йакын-Инкар"" экстремисттик уюмунун мүчөлөрүнүн үйлөрүнө тинтүү жүргүздү",ukuktartibi
Таласта милициянын сержанты пара алып жаткан жеринен кармалды (видео),ukuktartibi
Кыргызстанда бир жумада 23 миңден ашуун жол эрежесин бузуу фактысы катталды,ukuktartibi
Бишкекте мыйзамсыз сатылып жаткан күйүүчү май алынды,ukuktartibi
Балыкчыда окуучуну сүзүп кеткен окуя. Ага-ини милиционерлер убактылуу кармоо жайына киргизилди,ukuktartibi
Чүйдөгү №1 түзөтүү мекемесинде чыккан чуу токтотулду,ukuktartibi
Көлбаевдин уюшкан кылмыштуу тобунун мүчөсү чет өлкөдөн кармалды,ukuktartibi
Окуучуну сүзүп кеткен Балыкчы шаардык милиция бөлүмүнүн мурдагы башчысы кармалды,ukuktartibi
УКМК: Балыкчыда окуучу кызды сүзүп кеткен милициянын башчысы издөөгө алынды,ukuktartibi
Германиядан грант алып берем деген. Бишкекте алдамчылыкка шектелген аял кармалды,ukuktartibi
Прокуратура Балыкчы шаарында кызды унаа сүзүп кеткен факты боюнча кылмыш ишин козгоду,ukuktartibi
Бишкекте мыйзамсыз миграция уюштурган Пакистандын жараны кармалды,ukuktartibi
Аскер прокуратурасы баалуу металдарды сатып жиберген жетекчини камакка алды,ukuktartibi
Мурдагы аялынын кулак-мурдун кескен жаран 20 жылга эркинен ажыратылды,ukuktartibi
"Бишкекте ""Ала-Арча"" соода борборунун директору алдамчылыкка шектелип кармалды",ukuktartibi
Райымбек Матраимовго издөө жарыяланды,ukuktartibi
Бишкекте ири партиядагы контрафакттык энергетикалык суусундук аныкталды,ukuktartibi
Баткенде миллиондогон акчаны мыйзамсыз ташып жүргөн жаран кармалды (видео),ukuktartibi
Кара-Сууда базардын кожоюну ижарачылардан $10 миңге чейин мыйзамсыз акча чогултуп турган,ukuktartibi
Бишкекте кызмат абалынан пайдаланган сот аткаруучуга кылмыш иши козголду,ukuktartibi
"Окуучуга кол көтөрдү делген ""Сапаттын"" мугалими убактылуу кармоочу жайга киргизилди",ukuktartibi
Бажычылар салмактык көрсөткүчтөрдү төмөндөтүү фактыларын аныктады,ukuktartibi
"Жеке кызыкчылыгын көздөп, аскердик мүлктү сатууга шектүү кызматкер кармалды",ukuktartibi
Айдоочулардан 3 миң сомго чейин алып турушкан. Баткенде жол инспекторлорунун жоон тобу кармалды,ukuktartibi
Бишкекте жана Ошто мамлекеттер аралык издөөдө жүргөн жарандар кармалды,ukuktartibi
Жогорку Кеңештин депутаты Эмил Жамгырчиев камакка алынды,ukuktartibi
Баткенде чек арадан аткезчилик жүктөрдү алып өтүү аракеттерине бөгөт коюлду,ukuktartibi
УКМК: Жалал-Абад облусунда эл аралык баңгизат каналына бөгөт коюлду,ukuktartibi
Өзгөндө жер тилкелерин жеке менчикке берүү боюнча коррупциялык схема аныкталды,ukuktartibi
УКМК: Пара алууга шектелип Бишкектин Ленин районунун башкы архитектору кармалды,ukuktartibi
Кыргызстандан Өзбекстанга жалган документтер менен 11 унааны алып өтүү аракети көрүлгөн,ukuktartibi
Сокулукта сугат тармагына бөлүнгөн акчаны кымырып алган кызмат адамдарына кылмыш иши козголду,ukuktartibi
"УКМК ""Таза Конок"" муниципалдык ишканасынын жетекчисин кармады",ukuktartibi
Бажычылар Кытайдан унаа дөңгөлөктөрүн мыйзамсыз алып келүү аракетине бөгөт койду,ukuktartibi
"Кыргызстанга 5,5 тоннадан ашык жезди мыйзамсыз ташып кирүү аракети көрүлгөн",ukuktartibi
Сүлүктүдө 14 жаштагы өспүрүм кызды зордуктоого шектелген жаран кармалды,ukuktartibi
Жалал-Абадда унааны жасалма техникалык кароодон өткөрүү боюнча коррупциялык схема аныкталды,ukuktartibi
"МСК: Аламүдүн базарынан 11,7 миң куту контрафакттык тамеки тартып алынды",ukuktartibi
Башкы прокуратура: Аскерлерге зомбулук көрсөткөн жетекчилер камакка алынды,ukuktartibi
Бишкекте интимдик кызмат көрсөткөн 2 көмүскө жай аныкталды,ukuktartibi
Ош шаарында мамлекеттер аралык издөөдө жүргөн жаран кармалды,ukuktartibi
Кыргызстанга тамекини мыйзамсыз алып кирүү аракети көрүлгөн,ukuktartibi
Жалал-Абад шаарында күрөөкананын мыйзамсыз ишине бөгөт коюлду,ukuktartibi
"Ошто түнкүсүн дүкөндөргө кирип, уурулук кылып жүргөн топ кармалды",ukuktartibi
Ошто жүзүн таануу камерасы аркылуу издөөдө жүргөн жаран кармалды,ukuktartibi
Монополияга каршы жөнгө салуу кызматы SMS Taxi`ге 13 миң сом айып салды,ukuktartibi
ЖАК: Түзөтүү мекемесине баңгизатын жашыруун алып өтүү аракетине бөгөт коюлду,ukuktartibi
"Бишкектеги базарлардын биринде мыйзамсыз тамеки саткандар аныкталды. Жүгүртүүдөн 8,5 миң куту алынды",ukuktartibi
"УКМК: ""Берекет"" базар комплекстеринин негиздөөчүсү жана башкы директору кармалды",ukuktartibi
Бишкек-Самара поездинде Россиянын жасалма паспорту менен жүргөн жаран кармалды,ukuktartibi
Лейлекте милиция мас абалында аялын сабаган жаранды кармады,ukuktartibi
"Ошто коркутуу жолу менен акча талап кылган ""Коен"" каймана аттуу УКТ мүчөсү кармалды",ukuktartibi
ИИМ “Ихсан Групп ЛТД” турак жай курулуш кооперативинин ишин иликтөөнү улантууда,ukuktartibi
Базар-Коргондо алдамчылык менен алектенген коңшу өлкөнүн жараны кармалды,ukuktartibi
Бишкекте кармалган 11 журналист тергөө абагына эки айга камалды,ukuktartibi
"Кадамжайда унаа сатып алып, акчасын бербей жүргөн жаран Оштон кармалды",ukuktartibi
Лейлекте соцтармак аркылуу экстремисттик материалдарды тараткан жаран кармалды,ukuktartibi
Ошто күчтүү таасир этүүчү дарыларды рецептсиз саткандар аныкталды,ukuktartibi
2023-жылы Кыргызстанда каржы пирамидасына байланыштуу 358 иш тергелди,ukuktartibi
ИИМ: Массалык башаламандыкка чакыруу фактысы боюнча 11 журналист кармалды,ukuktartibi
Бажычылар унааларды мыйзамсыз ташып келүү фактысын аныктады,ukuktartibi
УКМК системалуу түрдө аялын уруп-токмоктоп жүргөн жаранды кармады. Сүрөт,ukuktartibi
"""Айт Айт Десе"" жана ""Темиров лайвдын"" баракчаларында массалык башаламандыкка чакырыктар жасалган. ИИМ иш козгоду",ukuktartibi
Бишкек шаардык соту 3 адамдын өлүмүнө шектүүнү өмүр бою эркинен ажыратуу чечимин күчүндө калтырды,ukuktartibi
Ошто унаа жуучу жайлардан акча уурдап жүргөн кылмыштуу топ кармалды,ukuktartibi
УКМК: Чек ара кызматкерлерине пара берүү фактысы боюнча бир топ адам кармалды,ukuktartibi
"УКМК: Жалал-Абадда базар комплексинин ээси кирешесин жашырып, салык төлөөдөн качкан",ukuktartibi
Кара-Сууда кызмат абалынан пайдаланган аткаминерлер кармалды,ukuktartibi
Жалал-Абадда милиция буйрутма менен ишкерди өлтүрүүнү алдын алды,ukuktartibi
Бишкек жана Чүй облусунда бир суткада 42 мас айдоочу кармалды,ukuktartibi
УКМК: Ошто Досоновдун уюшкан кылмыштуу тобунун активдүү мүчөсү кармалды,ukuktartibi
УКМК: Бакай-Ата райондук билим берүү бөлүмүнүн башчысы кармалды,ukuktartibi
"УКМК: Сокулук районундагы ""жер мафиясын"" уюштуруучулар камакка алынды",ukuktartibi
"Кара-Суу районунда сот аткаруучу опузалап, акча алып жаткан жеринен кармалды",ukuktartibi
Салык кызматынын Базар-Коргон району боюнча башкармалыгынын башчысы кармалды,ukuktartibi
Башкы прокуратура: Базар-Коргондо сот аткаруучуларга кылмыш иши козголду,ukuktartibi
Башкы прокуратура Арстан Алайдын өлүмү боюнча кылмыш ишин козгоду,ukuktartibi
Лейлек районунун тургунун 130 миңге алдап кеткен жаран Россиядан кармалды,ukuktartibi
Жалал-Абадда документтерди жасалмалаганы үчүн издөөдө жүргөн аял кармалды,ukuktartibi
УКМК: Ташов менен Куреновдун мамлекеттик төңкөрүш жасоо аракетине катышкан активдүү өнөктөштөрү кармалды,ukuktartibi
Жалал-Абаддагы таксидеги атышуу. Шектүүлөрдүн дагы экөө кармалды,ukuktartibi
Орточо баасы 3 млн сом. Кыргызстанга коңшу өлкөлөрдүн биринен газ баллондорун алып өтүүгө аракет кылышкан,ukuktartibi
"Россияда оор кылмыш жасап, эл аралык издөөдө жүргөн жаран Бишкектен кармалды",ukuktartibi
УКМК: Имамидин Ташов бийликти күч менен басып алууга аракет кылган делип издөөгө жарыяланды,ukuktartibi
Жалал-Абадда 14 жаштагы кыз мейманканада зордукталган. Шектүүнүн өздүгү аныкталды,ukuktartibi
Ошто Калкты тейлөө борборунун адиси алдамчылыкка шектелүүдө,ukuktartibi
УКМК Көлбаевдин кылмыштуу кирешелерин адалдоого тиешелүү бар делген жаранды кармады,ukuktartibi
Чүйдө кыз ала качууга шектелип эки жигит кармалды,ukuktartibi
Кызыл-Кыя шаарында баңгизат алып жүргөн жаран кармалды,ukuktartibi
Түп районунда ишкердин үйүнө каракчылык менен кол салгандар кармалды,ukuktartibi
"Чоң-Алайда мал уурдап, ашканага өткөрүп жүргөн жаран кармалды",ukuktartibi
Жалал-Абадда чек арадан аткезчилик жол менен дары жана жылкы алып өтүү аракетине бөгөт коюлду,ukuktartibi
Ошто жүзүн таануу камерасы аркылуу издөөдө жүргөн жаран кармалды,ukuktartibi
"Ижарачылардан мыйзамсыз акча чогултуп жүргөн. УКМК ""Уста"" базарынын коммерциялык директорун кармады",ukuktartibi
Баткенде асыл тукум букаларды коңшу өлкөгө айдап бараткан жаран кармалды,ukuktartibi
Кыргызстандын аймагында бир жумада 17 миңге жакын жол эрежесин бузуу фактысы катталды,ukuktartibi
Бишкекте издөөдө жүргөн Казакстандын жараны кармалды,ukuktartibi
Арстан Алайдын өлүмү. Башкы прокуратура текшерүүнү баштады,ukuktartibi
ИИМ: Мал уурулук менен алектенген топтун кылмыштуу аракетине бөгөт коюлду,ukuktartibi
ИИМ: Түптө баңгизат өндүргөн лабораториянын ишине бөгөт коюлду,ukuktartibi
УКМК: Баткен районундагы 12 дарыканада контрабандалык дары-дармектер аныкталды,ukuktartibi
ЖКККББ: Жол эрежесин одоно бузган автобустун айдоочусуна 15 миң сом айып салынды,ukuktartibi
Бишкекте мектеп жана соода борборлоруна бомба коюлганы тууралуу жалган маалымат бергендер кармалды,ukuktartibi
УКМК салыкчыларды кармады. Алар патентке төлөнчү каражатты ыйгарып алган деп айыпталууда,ukuktartibi
УКМК аткезчилик жүктөрдү мыйзамсыз ташуу боюнча түзүлгөн ири каналга бөгөт койду,ukuktartibi
УКМК: Күрөөкана кызматын пайдаланып алдамчылык кылган фактылар аныкталды,ukuktartibi
"ИИМ ""Элдик көзөмөл"" коомдук бирикмесинин мүчөсү баңгизат менен кармалганын билдирди",ukuktartibi
"УКМК: “Дордой”, “Ак-Суу”, “Алкан”, “Кербен” базарларында соодагерлерден негизсиз акча чогултулган",ukuktartibi
УКМК Маммүлктү башкаруу агенттигинин директорунун орун басарын кармады,ukuktartibi
Аламүдүн айыл өкмөтүнүн башчысы жана башкы эсепчиси пара алууга шектелип кармалды,ukuktartibi
Жалал-Абадда чиркөөдө террордук чабуул жасоого аракет кылган өспүрүмдөр кармалды,ukuktartibi
УКМК эки жылдан бери издөөдө жүргөн жаранды кармады. Ал адам уурдоого шектелүүдө,ukuktartibi
УКМК: Интимдик кызмат көрсөтүүчү жайлардын ишмердүүлүгүнө бөгөт коюлду,ukuktartibi
“Аскер Курулуш” ишканасынын директору коррупцияга шектелип камакка алынды,ukuktartibi
"Талас облусунун жергиликтүү кеңешинин депутаты кармалды. Ал 4,2 млн сом опузалоого шектелүүдө",ukuktartibi
УКМК: Оштогу №25 колониядагы камералардан тыюу салынган буюмдар табылды,ukuktartibi
Ысык-Көл районунда жергиликтүү тургундун үйүнөн 11 кг баңгизат табылды,ukuktartibi
Бишкекте бөтөлкөлөшүн бачыктаган кыз кармалды,ukuktartibi
Лейлекте жашы жете электерге нике кыюуга шектелип мечит имамы кармалды,ukuktartibi
Кыргызстанда бир жумада 400дөй мас айдоочу кармалды,ukuktartibi
УКМК “Хизб ут-Тахрир” уюмунун “Каракол жана Түп” ячейкасынын активдүү мүчөлөрүнүн үйүндө тинтүү жүргүздү,ukuktartibi
УКМК: Арашан айылында көрүстөндүн аймагында курал-жарак сакталган жай табылды,ukuktartibi
"Салык кызматы мыйзамсыз жүгүртүүдөн 4,5 тоннадан ашык күйүүчү майды тартып алды",ukuktartibi
Бишкекте тиш догдурда чарчап калган кичинекей кыздын өлүмү боюнча кылмыш иши козголду,ukuktartibi
Баткенде жер махинациясына байланыштуу бир катар кызмат адамдары кармалды,ukuktartibi
УКМК Көлбаевдин уюшкан кылмыштуу тобунун мүчөсүн кармады. Ал ишкерден $5 миң опузалаган,ukuktartibi
Ысык-Көл облусунун эки тургуну баңгизат сатууга шектелип кармалды,ukuktartibi
ИИМ: Жер маселелерин жөнгө салуу жаатында одоно мыйзам бузуулар аныкталды,ukuktartibi
УКМК Көлбаев менен байланышы бар деп мурдагы депутаттын уулун кармады. Окуянын чоо-жайы,ukuktartibi
Ысык-Көлдө жергиликтүү тургундун үйүнөн курал-жарак жана ок-дарылар табылды,ukuktartibi
Кыргызстандан Өзбекстанга 4 млн сомдук мал айдап өтүү аракетине бөгөт коюлду,ukuktartibi
Кадамжайда адам өлтүрүүгө шектүү кылмыш изи сууй электе кармалды,ukuktartibi
УКМК Кадыр Досоновдун уюшкан кылмыштуу тобунун активдүү мүчөсүн кармады,ukuktartibi
Бишкектеги №67 мектептин окуучулары эвакуацияланды. Бомба боюнча кайрадан маалымат түштү,ukuktartibi
УКМК эл аралык баңги каналына тиешеси бар чет элдик жарандарды кармады,ukuktartibi
32 млн сомдон ашуун. Ошто ири алдамчылыкка шектелип эже-сиңдилер кармалды,ukuktartibi
УКМК Жалал-Абадда аткезчиликке көмөктөшкөн 8 чек арачыны кармады (видео),ukuktartibi
"УКМК: Баткен облусунда 2,6 млн сомдук аткезчилик жүк кармалды",ukuktartibi
УКМК Кара-Суу базарындагы соодагерлерден акча талап кылган салыкчыларды кармады,ukuktartibi
Жалал-Абадда милициянын капитаны баңгизат сатуу каналын уюштурган. Шектүүлөр кармалды,ukuktartibi
Кыргызстандын аймагында бир жумада 14 миңге жакын жол эрежесин бузуу фактысы катталды,ukuktartibi
Арстан Алай 15-январга чейин камакка алынды,ukuktartibi
Чүйдө Daewoo Nexia унаасын айдап качкан жарандар кармалды,ukuktartibi
Ошто опузалап акча талап кылууга шектүү коомдук бирикменин мүчөлөрү кармалды,ukuktartibi
Бишкекте эки жаран баңгизат сатуу учурунда кармалды,ukuktartibi
УКМК диний кастыкты козутуу фактысы боюнча Арстан Алай кармалганын билдирди,ukuktartibi
"Түптө тургундарды опузалап, акча талап кылган 3 милиция кызматкери кармалды",ukuktartibi
ИИМ: Мурда жогорку кызматты ээлеген жаран ири алдамчылыкка шектелип кармалды,ukuktartibi
"УКМК ""Орто-Сай” базарындагы соодагерлерден мыйзамсыз акча чогулткан дагы бир салыкчыны кармады",ukuktartibi
УКМК: Кримтөбөл Рысбек Акматбаевди мыкаачылык менен өлтүргөн кылмыштын бети ачылды,ukuktartibi
Бишкекте издөөдө жүргөн уюшкан кылмыштуу топтун мүчөсү кармалды,ukuktartibi
Кара-Суу райондук мамлекеттик администрациясынын башкы эсепчиси пара менен кармалды,ukuktartibi
Бишкекте ишке орноштурууну убадалап жарандарды алдап жүргөн шектүү кармалды,ukuktartibi
ИИМ: Чолпон-Атада 15 жыл мурдагы адам өлтүрүү фактысынын бети ачылды,ukuktartibi
УКМК массалык башаламандыкка элди үндөдү деп интернет колдонуучуну кармады,ukuktartibi
"Кыргызстанда бир жумада 18,4 миң жол эрежесин бузуу фактысы катталды",ukuktartibi
УКМК МСКнын буга чейин “Дордойдо” салык чогултууга жооптуу болгон беш кызматкерин кармады,ukuktartibi
УКМК: Медициналык-социалдык эксперттик комиссиясынын кызматкерлери кармалды,ukuktartibi
